{
  "registry_id": "distillation.agon_candidate_handoff.v1",
  "schema_version": "distillation-agon-candidate-handoff.seed/0.1",
  "status": "candidate_lane_map",
  "title": "Distillation Agon candidate handoff lanes",
  "source_surfaces": {
    "epistemic_technique_candidates": "mechanics/agon/parts/epistemic-technique-candidates/generated/agon_epistemic_technique_candidates.min.json",
    "move_technique_bridge": "mechanics/agon/parts/move-technique-bridge/generated/agon_technique_binding_candidates.min.json"
  },
  "entries": [
    {
      "candidate_ref": "candidate:aoa-techniques:agon/assert-position-practice",
      "source_part": "move-technique-bridge",
      "source_status": "requested_not_landed",
      "source_label": "assert_position",
      "distillation_lane": "source_boundary_hold",
      "distillation_gate": {
        "atomic_move_status": "not_named_cleanly",
        "atomic_move_note": "asserting a position still depends on Agon stance grammar before it can become one portable practice move",
        "likely_domain": "agent-workflows",
        "primary_kind": "unassigned-until-narrowed",
        "family_posture": "Agon move-practice candidate; source-bound",
        "capability_class": "position",
        "substrate": "argument state",
        "execution_profile": "orchestration-required",
        "risk_posture": "lawful-move-authority-drift",
        "portable_core": "portable only after the practice is restated as bounded position expression outside Agon move law"
      },
      "bridge": {
        "higher_law": "Agents-of-Abyss mechanics/agon owns lawful move vocabulary and owner binding.",
        "local_route": "Hold in the Agon source-boundary lane until Distillation can name one non-legal practice atom.",
        "nearest_wrong_owner": "aoa-skills",
        "bridge_stop_line": "Do not define Agon law, create a skill workflow, issue proof verdicts, write scars, or start arena runtime."
      },
      "next_move": "Find one non-Agon position-statement example before writing an atom card."
    },
    {
      "candidate_ref": "candidate:aoa-techniques:agon/challenge-claim-practice",
      "source_part": "move-technique-bridge",
      "source_status": "requested_not_landed",
      "source_label": "challenge_claim",
      "gate_card": "mechanics/distillation/parts/agon-candidate-handoff/gates/challenge-claim-practice.md",
      "gate_example": "mechanics/distillation/parts/agon-candidate-handoff/gates/examples/challenge-claim-minimal-public-safe.md",
      "gate_checklist": "mechanics/distillation/parts/agon-candidate-handoff/gates/checklists/challenge-claim-gate-checklist.md",
      "gate_evidence_note": "mechanics/distillation/parts/agon-candidate-handoff/gates/evidence-notes/challenge-claim-gate-evidence-note.md",
      "bundle_readiness_review": "mechanics/distillation/parts/agon-candidate-handoff/gates/bundle-reviews/challenge-claim-bundle-readiness-review.md",
      "technique_bundle": "techniques/proof/review-evidence/single-locus-claim-challenge/TECHNIQUE.md",
      "distillation_lane": "first_narrowing_watch",
      "distillation_gate": {
        "atomic_move_status": "candidate_named",
        "atomic_move_note": "challenge one claim by naming the challenged statement, the pressure reason, and the evidence needed next",
        "likely_domain": "agent-workflows",
        "primary_kind": "guardrail",
        "family_posture": "claim-pressure and review-evidence practice; first bundle landed locally",
        "capability_class": "challenge",
        "substrate": "claim text",
        "execution_profile": "small-agent",
        "risk_posture": "argument-escalation-drift",
        "portable_core": "portable as bounded claim challenge without Agon move legality or arena effects"
      },
      "bridge": {
        "higher_law": "Agents-of-Abyss mechanics/agon owns lawful challenge vocabulary.",
        "local_route": "Use the landed bundle focused on target claim, challenged locus, pressure reason, and next support question.",
        "nearest_wrong_owner": "aoa-evals",
        "bridge_stop_line": "Do not make the challenge a proof verdict, rank effect, scar, or live arena move."
      },
      "next_move": "Keep the landed bundle at promoted/source-backed posture and collect second-context evidence before any canonical review, without changing Agon source status."
    },
    {
      "candidate_ref": "candidate:aoa-techniques:agon/request-evidence-practice",
      "source_part": "move-technique-bridge",
      "source_status": "requested_not_landed",
      "source_label": "request_evidence",
      "gate_card": "mechanics/distillation/parts/agon-candidate-handoff/gates/request-evidence-practice.md",
      "gate_example": "mechanics/distillation/parts/agon-candidate-handoff/gates/examples/request-evidence-minimal-public-safe.md",
      "gate_checklist": "mechanics/distillation/parts/agon-candidate-handoff/gates/checklists/request-evidence-gate-checklist.md",
      "gate_evidence_note": "mechanics/distillation/parts/agon-candidate-handoff/gates/evidence-notes/request-evidence-gate-evidence-note.md",
      "bundle_readiness_review": "mechanics/distillation/parts/agon-candidate-handoff/gates/bundle-reviews/request-evidence-bundle-readiness-review.md",
      "technique_bundle": "techniques/proof/review-evidence/single-missing-evidence-request/TECHNIQUE.md",
      "distillation_lane": "first_narrowing_watch",
      "distillation_gate": {
        "atomic_move_status": "candidate_named",
        "atomic_move_note": "ask for the smallest missing evidence object that would change the review state",
        "likely_domain": "agent-workflows",
        "primary_kind": "guardrail",
        "family_posture": "evidence-request and review-state practice; first bundle landed locally",
        "capability_class": "request-evidence",
        "substrate": "review state",
        "execution_profile": "small-agent",
        "risk_posture": "evidence-theater",
        "portable_core": "portable as a small evidence request outside OS Abyss and outside Agon protocol"
      },
      "bridge": {
        "higher_law": "Agents-of-Abyss mechanics/agon owns evidence move law.",
        "local_route": "Run one gate card focused on missing evidence object, review state, and stop condition.",
        "nearest_wrong_owner": "aoa-evals",
        "bridge_stop_line": "Do not treat an evidence request as proof, verdict, or eval authority."
      },
      "next_move": "Keep the landed bundle at promoted/source-backed posture and collect second-context evidence before any canonical review, without changing Agon source status."
    },
    {
      "candidate_ref": "candidate:aoa-techniques:agon/offer-evidence-reference-practice",
      "source_part": "move-technique-bridge",
      "source_status": "requested_not_landed",
      "source_label": "offer_evidence_reference",
      "gate_card": "mechanics/distillation/parts/agon-candidate-handoff/gates/offer-evidence-reference-practice.md",
      "gate_example": "mechanics/distillation/parts/agon-candidate-handoff/gates/examples/offer-evidence-reference-minimal-public-safe.md",
      "gate_checklist": "mechanics/distillation/parts/agon-candidate-handoff/gates/checklists/offer-evidence-reference-gate-checklist.md",
      "gate_evidence_note": "mechanics/distillation/parts/agon-candidate-handoff/gates/evidence-notes/offer-evidence-reference-gate-evidence-note.md",
      "bundle_readiness_review": "mechanics/distillation/parts/agon-candidate-handoff/gates/bundle-reviews/offer-evidence-reference-bundle-readiness-review.md",
      "technique_bundle": "techniques/proof/review-evidence/single-scoped-evidence-reference/TECHNIQUE.md",
      "distillation_lane": "first_narrowing_watch",
      "distillation_gate": {
        "atomic_move_status": "candidate_named",
        "atomic_move_note": "offer one evidence reference with scope, relevance, and limit before relying on it",
        "likely_domain": "docs",
        "primary_kind": "artifact",
        "family_posture": "review-evidence reference practice; first bundle landed locally",
        "capability_class": "cite",
        "substrate": "evidence reference",
        "execution_profile": "small-agent",
        "risk_posture": "citation-overclaim",
        "portable_core": "portable as scoped evidence-reference offering without Agon verdict authority"
      },
      "bridge": {
        "higher_law": "Agents-of-Abyss mechanics/agon owns evidence-reference move law.",
        "local_route": "Run one gate card focused on source, relevance, scope, and limit.",
        "nearest_wrong_owner": "aoa-evals",
        "bridge_stop_line": "Do not turn a reference into proof verdict, source truth transfer, or KAG promotion."
      },
      "next_move": "Keep the landed bundle at promoted/source-backed posture and collect second-context evidence before any canonical review, without changing Agon source status."
    },
    {
      "candidate_ref": "candidate:aoa-techniques:agon/probe-trace-practice",
      "source_part": "move-technique-bridge",
      "source_status": "requested_not_landed",
      "source_label": "probe_trace",
      "distillation_lane": "first_narrowing_watch",
      "distillation_gate": {
        "atomic_move_status": "candidate_named",
        "atomic_move_note": "probe one reasoning or provenance trace for the next missing link",
        "likely_domain": "history",
        "primary_kind": "trace-probe",
        "family_posture": "trace review practice; not yet a bundle",
        "capability_class": "inspect",
        "substrate": "trace artifact",
        "execution_profile": "medium-agent",
        "risk_posture": "trace-closure-overclaim",
        "portable_core": "portable as one trace-probe move before closure or memory writeback"
      },
      "bridge": {
        "higher_law": "Agents-of-Abyss mechanics/agon owns trace move law.",
        "local_route": "Run one gate card focused on one missing trace link and no closure claim.",